{
  "aggregates": {
    "full": {
      "compile_pass_rate": 0.6595744680851063,
      "primer_amortized_total": 34012,
      "python_tokens_total": 4584,
      "tacit_tokens_total": 549258,
      "task_count": 47,
      "tests_pass_rate": 0.46808510638297873,
      "tests_pass_total": 174,
      "tests_total_total": 215,
      "token_delta": 118.82068062827226,
      "typecheck_pass_rate": 0.8085106382978723
    },
    "non_stdlib_dominated": {
      "compile_pass_rate": 0.6521739130434783,
      "primer_amortized_total": 33585,
      "python_tokens_total": 4466,
      "tacit_tokens_total": 537630,
      "task_count": 46,
      "tests_pass_rate": 0.4782608695652174,
      "tests_pass_total": 174,
      "tests_total_total": 207,
      "token_delta": 119.38289296909987,
      "typecheck_pass_rate": 0.8043478260869565
    },
    "stdlib_dominated": {
      "compile_pass_rate": 1.0,
      "primer_amortized_total": 11628,
      "python_tokens_total": 118,
      "tacit_tokens_total": 11628,
      "task_count": 1,
      "tests_pass_rate": 0.0,
      "tests_pass_total": 0,
      "tests_total_total": 8,
      "token_delta": 97.54237288135593,
      "typecheck_pass_rate": 1.0
    }
  },
  "gates": {
    "passed_overall": false,
    "primary_pass_rate_gate": {
      "applies": true,
      "metric": "tests_pass_rate",
      "passed": false,
      "scope": "full",
      "threshold": 0.7,
      "value": 0.46808510638297873
    },
    "primary_token_gate_full": {
      "applies": true,
      "metric": "token_delta",
      "passed": false,
      "scope": "full",
      "threshold": -0.3,
      "value": 118.82068062827226
    },
    "primary_token_gate_non_stdlib": {
      "applies": true,
      "metric": "token_delta",
      "passed": false,
      "scope": "non_stdlib_dominated",
      "threshold": -0.3,
      "value": 119.38289296909987
    }
  },
  "model": {
    "id": "claude-sonnet-4-6",
    "primer_hash": "7459a4b9258ee14d91484ee3df1d2fd27c6338b1f3ac78934eba2ef5da0bb4ea",
    "primer_tokens": 11201,
    "provider": "anthropic"
  },
  "run_id": "019de1b6-7f56-744f-9c01-28cbd3419a03",
  "schema_version": "p3.0",
  "scope": "open",
  "tasks": [
    {
      "compile_pass": true,
      "diagnostics": null,
      "duration_ms": 2320,
      "generation_tokens": 105,
      "python_baseline_tokens": 60,
      "retries": 0,
      "stdlib_dominated": false,
      "task_id": "arithmetic/001-sum-to-n",
      "tests_pass": 5,
      "tests_total": 5,
      "typecheck_pass": true
    },
    {
      "compile_pass": true,
      "diagnostics": null,
      "duration_ms": 2991,
      "generation_tokens": 121,
      "python_baseline_tokens": 72,
      "retries": 0,
      "stdlib_dominated": false,
      "task_id": "arithmetic/003-factorial",
      "tests_pass": 5,
      "tests_total": 5,
      "typecheck_pass": true
    },
    {
      "compile_pass": true,
      "diagnostics": null,
      "duration_ms": 4035,
      "generation_tokens": 162,
      "python_baseline_tokens": 51,
      "retries": 0,
      "stdlib_dominated": false,
      "task_id": "arithmetic/004-gcd",
      "tests_pass": 10,
      "tests_total": 10,
      "typecheck_pass": true
    },
    {
      "compile_pass": true,
      "diagnostics": null,
      "duration_ms": 6806,
      "generation_tokens": 379,
      "python_baseline_tokens": 125,
      "retries": 0,
      "stdlib_dominated": false,
      "task_id": "arithmetic/005-is-prime",
      "tests_pass": 10,
      "tests_total": 10,
      "typecheck_pass": true
    },
    {
      "compile_pass": true,
      "diagnostics": null,
      "duration_ms": 3271,
      "generation_tokens": 149,
      "python_baseline_tokens": 57,
      "retries": 0,
      "stdlib_dominated": false,
      "task_id": "arithmetic/006-digit-sum",
      "tests_pass": 7,
      "tests_total": 7,
      "typecheck_pass": true
    },
    {
      "compile_pass": true,
      "diagnostics": null,
      "duration_ms": 4721,
      "generation_tokens": 198,
      "python_baseline_tokens": 90,
      "retries": 0,
      "stdlib_dominated": false,
      "task_id": "arithmetic/007-to-binary",
      "tests_pass": 6,
      "tests_total": 6,
      "typecheck_pass": true
    },
    {
      "compile_pass": false,
      "diagnostics": {
        "errors": [
          {
            "actual": null,
            "expected": null,
            "fix": null,
            "kind": "extraction-error",
            "location": {
              "ast_path": [],
              "source_span": null
            },
            "message": "model response contained multiple ```tacit fenced blocks",
            "related": [],
            "severity": "error"
          }
        ],
        "schema_version": "p2.0"
      },
      "duration_ms": 33073,
      "generation_tokens": 0,
      "python_baseline_tokens": 145,
      "retries": 0,
      "stdlib_dominated": false,
      "task_id": "arithmetic/009-divisors",
      "tests_pass": 0,
      "tests_total": 0,
      "typecheck_pass": false
    },
    {
      "compile_pass": true,
      "diagnostics": null,
      "duration_ms": 3420,
      "generation_tokens": 178,
      "python_baseline_tokens": 88,
      "retries": 0,
      "stdlib_dominated": false,
      "task_id": "arithmetic/010-power",
      "tests_pass": 7,
      "tests_total": 7,
      "typecheck_pass": true
    },
    {
      "compile_pass": false,
      "diagnostics": {
        "errors": [
          {
            "actual": null,
            "expected": null,
            "fix": null,
            "kind": "extraction-error",
            "location": {
              "ast_path": [],
              "source_span": null
            },
            "message": "model response contained multiple ```tacit fenced blocks",
            "related": [],
            "severity": "error"
          }
        ],
        "schema_version": "p2.0"
      },
      "duration_ms": 21286,
      "generation_tokens": 0,
      "python_baseline_tokens": 37,
      "retries": 0,
      "stdlib_dominated": false,
      "task_id": "strings/011-reverse-string",
      "tests_pass": 0,
      "tests_total": 0,
      "typecheck_pass": false
    },
    {
      "compile_pass": true,
      "diagnostics": null,
      "duration_ms": 4547,
      "generation_tokens": 272,
      "python_baseline_tokens": 60,
      "retries": 0,
      "stdlib_dominated": false,
      "task_id": "strings/012-count-vowels",
      "tests_pass": 6,
      "tests_total": 6,
      "typecheck_pass": true
    },
    {
      "compile_pass": true,
      "diagnostics": {
        "errors": [
          {
            "actual": null,
            "expected": null,
            "fix": null,
            "kind": "test-failure",
            "location": {
              "ast_path": [],
              "source_span": null
            },
            "message": "stdout mismatch for unicode: expected 'yes\\n', got b'no\\n'",
            "related": [],
            "severity": "error"
          }
        ],
        "schema_version": "p2.0"
      },
      "duration_ms": 5405,
      "generation_tokens": 292,
      "python_baseline_tokens": 65,
      "retries": 0,
      "stdlib_dominated": false,
      "task_id": "strings/013-is-palindrome",
      "tests_pass": 7,
      "tests_total": 8,
      "typecheck_pass": true
    },
    {
      "compile_pass": true,
      "diagnostics": null,
      "duration_ms": 6279,
      "generation_tokens": 465,
      "python_baseline_tokens": 63,
      "retries": 0,
      "stdlib_dominated": false,
      "task_id": "strings/015-title-case",
      "tests_pass": 8,
      "tests_total": 8,
      "typecheck_pass": true
    },
    {
      "compile_pass": true,
      "diagnostics": {
        "errors": [
          {
            "actual": null,
            "expected": null,
            "fix": null,
            "kind": "test-failure",
            "location": {
              "ast_path": [],
              "source_span": null
            },
            "message": "stdout mismatch for tie-first: expected 'cat\\n', got b'hat\\n\\n'; stdout mismatch for two-word-tie: expected 'hello\\n', got b'world\\n\\n'; stdout mismatch for single: expected 'programming\\n', got b'programming\\n\\n'; 1 more failure(s)",
            "related": [],
            "severity": "error"
          }
        ],
        "schema_version": "p2.0"
      },
      "duration_ms": 6548,
      "generation_tokens": 316,
      "python_baseline_tokens": 89,
      "retries": 0,
      "stdlib_dominated": false,
      "task_id": "strings/016-longest-word",
      "tests_pass": 2,
      "tests_total": 6,
      "typecheck_pass": true
    },
    {
      "compile_pass": false,
      "diagnostics": {
        "errors": [
          {
            "actual": null,
            "expected": null,
            "fix": null,
            "kind": "typecheck-error",
            "location": {
              "ast_path": [],
              "source_span": null
            },
            "message": "error: /tmp/tmpce3hirpy/generated.tac: expected 'in' but got RParen",
            "related": [],
            "severity": "error"
          }
        ],
        "schema_version": "p2.0"
      },
      "duration_ms": 5951,
      "generation_tokens": 281,
      "python_baseline_tokens": 123,
      "retries": 0,
      "stdlib_dominated": false,
      "task_id": "strings/017-common-prefix",
      "tests_pass": 0,
      "tests_total": 0,
      "typecheck_pass": false
    },
    {
      "compile_pass": true,
      "diagnostics": null,
      "duration_ms": 5916,
      "generation_tokens": 336,
      "python_baseline_tokens": 137,
      "retries": 0,
      "stdlib_dominated": false,
      "task_id": "strings/018-run-length-encode",
      "tests_pass": 7,
      "tests_total": 7,
      "typecheck_pass": true
    },
    {
      "compile_pass": true,
      "diagnostics": null,
      "duration_ms": 8017,
      "generation_tokens": 530,
      "python_baseline_tokens": 103,
      "retries": 0,
      "stdlib_dominated": false,
      "task_id": "strings/020-is-anagram",